{
  "apiVersion": "workspace/v1",
  "kind": "WorkspaceManifest",
  "metadata": {
    "workspaceName": "shiftstone",
    "frameworkName": "ShiftStone",
    "version": "2.1.0-universal",
    "updatedAt": "2026-10-20T23:15:00.000Z"
  },
  "spec": {
    "activePacks": [
      "rr8-supabase-cf"
    ],
    "budgets": {
      "agentsMaxLines": 60,
      "agentsMaxBytes": 4096,
      "ruleMaxLines": 120,
      "ruleMaxBytes": 6144,
      "alwaysOnMaxBytes": 12288,
      "skillManifestMaxLines": 180,
      "skillInstructionsMaxLines": 450
    },
    "schemas": {
      "stageContract": ".shiftstone/governance/schemas/stage-contract.schema.json",
      "planUnit": ".shiftstone/governance/schemas/plan-unit-v1.schema.json",
      "preflightReceipt": ".shiftstone/governance/schemas/preflight-receipt.schema.json",
      "checkerLens": ".shiftstone/governance/schemas/checker-lens.schema.json",
      "checkerReport": ".shiftstone/governance/schemas/checker-report.schema.json",
      "learningRecord": ".shiftstone/governance/schemas/learning-record.schema.json",
      "protectedActionApproval": ".shiftstone/governance/schemas/protected-action-approval.schema.json",
      "releaseEvidence": ".shiftstone/governance/schemas/release-evidence.schema.json",
      "trajectory": ".shiftstone/governance/schemas/trajectory.schema.json",
      "telemetry": ".shiftstone/governance/schemas/telemetry.schema.json",
      "workspaceManifest": ".shiftstone/governance/schemas/workspace-manifest.schema.json",
      "implementationStatus": ".shiftstone/governance/schemas/implementation-status.schema.json"
    },
    "validators": [
      {
        "id": "validate-context-budgets",
        "scriptPath": ".shiftstone/scripts/validate-context-budgets.js",
        "phase": "phase-1",
        "description": "Validates Layer 0/1 context line/byte ceilings and cumulative always-on context budget"
      },
      {
        "id": "validate-context-integrity",
        "scriptPath": ".shiftstone/scripts/validate-context-integrity.js",
        "phase": "phase-1",
        "description": "Detects contradictory rules, core stack leaks, and forbidden legacy directives"
      },
      {
        "id": "setup-ide-junctions",
        "scriptPath": ".shiftstone/scripts/setup-ide-junctions.js",
        "phase": "phase-1",
        "description": "Establishes and verifies zero-duplication OS directory junctions to .agents/skills"
      },
      {
        "id": "validate-manifest",
        "scriptPath": ".shiftstone/scripts/validate-manifest.js",
        "phase": "phase-1",
        "description": "Validates workspace manifests, implementation status, and disk artifact consistency"
      },
      {
        "id": "validate-stage-contracts",
        "scriptPath": ".shiftstone/scripts/validate-stage-contracts.js",
        "phase": "phase-2",
        "description": "Validates ICM stage contracts, superseded-input blocking, and anti-placeholder law"
      },
      {
        "id": "validate-plan-units",
        "scriptPath": ".shiftstone/scripts/validate-plan-units.js",
        "phase": "phase-2",
        "description": "Validates atomic Plan Units (U*), requirement-to-test traceability, and acyclic DAG"
      },
      {
        "id": "agent-preflight",
        "scriptPath": ".shiftstone/scripts/agent-preflight.js",
        "phase": "phase-3",
        "description": "4-Layer Agent Pre-Flight Gate enforcing skill, bible, learning lookup, and verify cmd"
      },
      {
        "id": "validate-skills-completeness",
        "scriptPath": ".shiftstone/scripts/validate-skills-completeness.js",
        "phase": "phase-3",
        "description": "Two-tier skill validator enforcing 8-Pillar Anti-Bypass rules on ss-* skills"
      },
      {
        "id": "validate-research",
        "scriptPath": ".shiftstone/scripts/validate-research.js",
        "phase": "phase-3",
        "description": "Deterministic research brief, conclusion, and live web search receipt validator"
      },
      {
        "id": "validate-checker-lenses",
        "scriptPath": ".shiftstone/scripts/validate-checker-lenses.js",
        "phase": "phase-4",
        "description": "Validates core and pack conditional checker lenses against checker-lens/v1 schema"
      },
      {
        "id": "validate-checker-report",
        "scriptPath": ".shiftstone/scripts/validate-checker-report.js",
        "phase": "phase-4",
        "description": "Validates Two-Gate Consequence-Aware Maker-Checker review reports"
      },
      {
        "id": "check-anti-gaming",
        "scriptPath": ".shiftstone/scripts/check-anti-gaming.js",
        "phase": "phase-4",
        "description": "Pre-commit anti-gaming git diff gate blocking test deletion and bypass modifiers"
      },
      {
        "id": "validate-learning",
        "scriptPath": ".shiftstone/scripts/validate-learning.js",
        "phase": "phase-5",
        "description": "Validates curated learning records and Jaccard deduplication threshold"
      },
      {
        "id": "validate-decisions",
        "scriptPath": ".shiftstone/scripts/validate-decisions.js",
        "phase": "phase-5",
        "description": "Validates individual ADRs and open-question files, enforcing supersededBy"
      },
      {
        "id": "validate-protected-actions",
        "scriptPath": ".shiftstone/scripts/validate-protected-actions.js",
        "phase": "phase-6",
        "description": "Level 5 protected action approval verification gate"
      },
      {
        "id": "validate-release-evidence",
        "scriptPath": ".shiftstone/scripts/validate-release-evidence.js",
        "phase": "phase-6",
        "description": "Release evidence certification bundle validation gate"
      },
      {
        "id": "run-certification-trials",
        "scriptPath": ".shiftstone/scripts/run-certification-trials.js",
        "phase": "phase-7",
        "description": "Dual certification trials runner executing T1-T3 harness and F1-F6 factory capability trials"
      },
      {
        "id": "record-telemetry",
        "scriptPath": ".shiftstone/scripts/record-telemetry.js",
        "phase": "phase-7",
        "description": "Continuous quality flywheel telemetry recorder and validator"
      },
      {
        "id": "validate-workspace",
        "scriptPath": ".shiftstone/scripts/validate-workspace.js",
        "phase": "phase-7",
        "description": "Master orchestrator running all 15 validators across 5 deterministic stages"
      }
    ]
  }
}
